{
  "device_id": "device-0004",
  "device_session_id": "a3b88c64-e48c-5c91-b165-a5abbb1f491b",
  "event_id": "ec8fed53-6f9d-58fd-a3f4-f6e2df863569",
  "event_timestamp": "2026-08-19T14:32:10.125Z",
  "event_type": "device_health",
  "payload": {
    "cpu_pct": 44.8,
    "memory_pct": 62.1,
    "signal_quality_pct": 73.6,
    "temperature_c": 53.4
  },
  "schema_version": 1,
  "sequence_number": 15,
  "site_id": "site-0004"
}
